{
  "id": "implement-taskboard-board-card-parity",
  "version": "1.0",
  "name": "Implement Taskboard Board and Card Parity",
  "description": "Deliver a bounded SwiftUI Taskboard board or card slice toward Trello-like parity with explicit verification and handoff notes.",
  "parameters": [
    {
      "name": "featureScope",
      "type": "string",
      "required": true
    },
    {
      "name": "targetFiles",
      "type": "string[]",
      "required": true
    },
    {
      "name": "acceptanceCriteria",
      "type": "string[]",
      "required": false
    }
  ],
  "includesEssentialIds": [
    "taskboard-board-card-parity-checklist",
    "swift-style-guide",
    "swiftui-style-guide",
    "partner-trust-contract",
    "non-goals",
    "tools-and-constraints"
  ],
  "requiresSkillIds": [
    "codex-cli"
  ],
  "risk": {
    "level": "high",
    "requiresHumanReview": true,
    "notes": [
      "Stay inside the declared Taskboard UI write scope.",
      "Do not redesign persistence or mutation-engine behavior from this role.",
      "Record verification outcomes and residual rough edges before handoff."
    ]
  }
}
