{
  "id": "remediate-persona-hiring-gaps",
  "version": "1.0",
  "name": "Remediate Persona Hiring Gaps",
  "description": "Convert approved reverse-interview findings into bounded artifact updates and tracked closure work.",
  "parameters": [
    {
      "name": "candidatePersonaId",
      "type": "string",
      "required": true
    },
    {
      "name": "hiringReviewEntryId",
      "type": "string",
      "required": true
    },
    {
      "name": "approvedGapIds",
      "type": "string[]",
      "required": false
    },
    {
      "name": "targetArtifacts",
      "type": "string[]",
      "required": false
    }
  ],
  "includesEssentialIds": [
    "persona-hiring-standards",
    "persona-hiring-log-contract",
    "partner-trust-contract",
    "non-goals",
    "tools-and-constraints"
  ],
  "requiresSkillIds": [
    "codex-cli"
  ],
  "risk": {
    "level": "medium",
    "requiresHumanReview": true,
    "notes": [
      "Only remediate gaps explicitly approved by AJ.",
      "Keep artifact updates bounded to approved scope.",
      "Update hiring report and JSONL outputs after approved remediation."
    ]
  }
}
