{
  "id": "swift-refactor-safe",
  "version": "1.0",
  "name": "Swift Refactor (Safe)",
  "description": "Perform a small refactor without changing behavior.",
  "parameters": [
    {
      "name": "targetFiles",
      "type": "string[]",
      "required": true
    }
  ],
  "includesEssentialIds": [
    "swift-style-guide"
  ],
  "requiresSkillIds": [
    "codex-cli"
  ],
  "risk": {
    "level": "medium",
    "requiresHumanReview": true,
    "notes": [
      "No public API changes",
      "No behavior changes"
    ]
  }
}
