{
  "id": "venture-opportunity-triage",
  "version": "1.0",
  "name": "Venture Opportunity Triage",
  "description": "Evaluate three opportunity candidates and select one for MVP planning.",
  "parameters": [
    {
      "name": "candidateIdeas",
      "type": "string[]",
      "required": true
    },
    {
      "name": "constraints",
      "type": "string[]",
      "required": false
    }
  ],
  "includesEssentialIds": [
    "venture-studio-principles",
    "non-goals",
    "tools-and-constraints"
  ],
  "requiresSkillIds": [
    "codex-cli"
  ],
  "risk": {
    "level": "medium",
    "requiresHumanReview": true,
    "notes": [
      "Do not start implementation until AJ confirms selected opportunity.",
      "Record ethics risk and confidence for each candidate."
    ]
  }
}
