{
  "id": "track-macos-feature-delivery",
  "version": "1.0",
  "name": "Track macOS Feature Delivery",
  "description": "Maintain milestone status, blockers, and next actions for active feature delivery work.",
  "parameters": [
    {
      "name": "milestonePlanPath",
      "type": "string",
      "required": true
    },
    {
      "name": "statusWindow",
      "type": "string",
      "required": false
    },
    {
      "name": "focusMilestones",
      "type": "string[]",
      "required": false
    }
  ],
  "includesEssentialIds": [
    "roadmap-milestone-tracking-standard",
    "venture-product-quality-gate",
    "non-goals",
    "tools-and-constraints"
  ],
  "requiresSkillIds": [
    "codex-cli"
  ],
  "risk": {
    "level": "low",
    "requiresHumanReview": false,
    "notes": [
      "Do not hide blockers or scope changes.",
      "Keep status updates concise, evidence-backed, and actionable."
    ]
  }
}
