{
  "id": "worktree-squad-calibration-review",
  "version": "1.0",
  "name": "Worktree Squad Calibration Review",
  "description": "Calibrate squad-leader loop quality using benchmark cases and drift checks.",
  "parameters": [
    {
      "name": "calibrationCycle",
      "type": "string",
      "required": true
    },
    {
      "name": "benchmarkCases",
      "type": "string[]",
      "required": false
    }
  ],
  "includesEssentialIds": [
    "worktree-squad-calibration-benchmarks",
    "worktree-squad-loop-log-contract",
    "persona-hiring-calibration-playbook",
    "non-goals",
    "tools-and-constraints"
  ],
  "requiresSkillIds": [
    "codex-cli"
  ],
  "risk": {
    "level": "medium",
    "requiresHumanReview": true,
    "notes": [
      "Calibration drift findings should be recorded before proposing role changes.",
      "Do not modify core rubric or gate thresholds without AJ review.",
      "Keep calibration outputs deterministic and benchmark-traceable."
    ]
  }
}
