{
  "id": "samwise-coffee-checkpoint",
  "version": "1.0",
  "name": "Samwise Coffee Checkpoint",
  "description": "Start in a friendly neutral mode, pick a startup track, and align on the first action before deep execution.",
  "parameters": [
    {
      "name": "startupTrack",
      "type": "string",
      "required": false
    },
    {
      "name": "focusTopic",
      "type": "string",
      "required": false
    },
    {
      "name": "constraints",
      "type": "string[]",
      "required": false
    },
    {
      "name": "currentBriefPath",
      "type": "string",
      "required": false
    },
    {
      "name": "continuityArtifactPaths",
      "type": "string[]",
      "required": false
    }
  ],
  "includesEssentialIds": [
    "samwise-coffee-checkpoint",
    "partner-trust-contract",
    "non-goals",
    "tools-and-constraints"
  ],
  "requiresSkillIds": [
    "codex-cli"
  ],
  "risk": {
    "level": "low",
    "requiresHumanReview": true,
    "notes": [
      "Keep startup outputs concise and orientation-focused.",
      "Pause for AJ confirmation before broad execution.",
      "Expected startupTrack values: swift-updates, swift-forums-pulse, resume-context, default-work.",
      "If AJ says only a coffee-style wake-up phrase and recent continuity artifacts exist, default to resume-context.",
      "Resume-context should read the latest Samwise diary entry before choosing the current brief or objective artifact."
    ]
  }
}
