{
  "id": "assess-ticket-board-interaction-quality",
  "version": "1.0",
  "name": "Assess Ticket Board Interaction Quality",
  "description": "Evaluate lane-and-ticket planning UX against parity-oriented interaction standards and produce a prioritized quality report.",
  "parameters": [
    {
      "name": "featureScope",
      "type": "string",
      "required": true
    },
    {
      "name": "benchmarkReferences",
      "type": "string[]",
      "required": false
    },
    {
      "name": "artifactPaths",
      "type": "string[]",
      "required": false
    }
  ],
  "includesEssentialIds": [
    "interaction-quality-rubric",
    "planning-board-ux-patterns",
    "interaction-quality-report-template",
    "non-goals",
    "tools-and-constraints"
  ],
  "requiresSkillIds": [
    "codex-cli"
  ],
  "risk": {
    "level": "medium",
    "requiresHumanReview": true,
    "notes": [
      "Do not convert quality analysis into broad implementation without AJ review.",
      "List blockers explicitly with reproduction steps and owner.",
      "Keep recommendations bounded to the active feature scope."
    ]
  }
}
