{
  "id": "pack-maintenance-review",
  "version": "1.0",
  "name": "Pack Maintenance Review",
  "description": "Assess pack/session drift for an active phase and propose bounded updates with log traceability.",
  "parameters": [
    {
      "name": "phaseLabel",
      "type": "string",
      "required": true
    },
    {
      "name": "focusAreas",
      "type": "string[]",
      "required": false
    },
    {
      "name": "changedArtifacts",
      "type": "string[]",
      "required": false
    }
  ],
  "includesEssentialIds": [
    "pack-gardening-standards",
    "gardening-v2-checklist",
    "gardening-log-contract",
    "gardening-health-snapshot-contract",
    "pack-coverage-auditor-contract",
    "policy-conflict-detector-contract",
    "self-gardening-safety-preflight-contract",
    "gardening-recommendation-scoring-contract",
    "gardening-recommendation-feedback-contract",
    "non-goals",
    "tools-and-constraints"
  ],
  "requiresSkillIds": [
    "codex-cli"
  ],
  "risk": {
    "level": "medium",
    "requiresHumanReview": true,
    "notes": [
      "Do not apply broad pack/session rewrites without explicit approval.",
      "Log affected IDs and validation status for every accepted change.",
      "Record health snapshot and recommendation feedback updates for each maintenance pass.",
      "Recommendation ranking must include deterministic score breakdown and why-now explanation.",
      "Run coverage and policy/safety preflight checks before applying non-trivial self-gardening updates.",
      "Self-gardening updates must use the same review stop points and cannot bypass approval gates."
    ]
  }
}
